filename,topic,original,cleaned
music_2.txt,music,"Jazz is a music genre that originated in the African-American communities of New Orleans, Louisiana, in the late 19th and early 20th centuries. Its roots are in blues, ragtime, European harmony, African rhythmic rituals, spirituals, hymns, marches, vaudeville song, and dance music. Since the 1920s Jazz Age, it has been recognized as a major form of musical expression in traditional and popular music. Jazz is characterized by swing and blue notes, complex chords, call and response vocals, polyrhythms and improvisation. As jazz spread around the world, it drew on national, regional, and local musical cultures, which gave rise to different styles. New Orleans jazz began in the early 1910s, combining earlier brass band marches, French quadrilles, biguine, ragtime and blues with collective polyphonic improvisation. However, jazz did not begin as a single musical tradition in New Orleans or elsewhere. In the 1930s, arranged dance-oriented swing big bands, Kansas City jazz (a hard-swinging, bluesy, improvisational style), and gypsy jazz (a style that emphasized musette waltzes) were the prominent styles. Bebop emerged in the 1940s, shifting jazz from danceable popular music toward a more challenging ""musician's music"" which was played at faster tempos and used more chord-based improvisation. Cool jazz developed near the end of the 1940s, introducing calmer, smoother sounds and long, linear melodic lines. The mid-1950s saw the emergence of hard bop, which introduced influences from rhythm and blues, gospel, and blues to small groups and particularly to saxophone and piano. Modal jazz developed in the late 1950s, using the mode, or musical scale, as the basis of musical structure and improvisation, as did free jazz, which explored playing without regular meter, beat and formal structures. Jazz fusion appeared in the late 1960s and early 1970s, combining jazz improvisation with rock music's rhythms, electric instruments, and highly amplified stage sound. In the early 1980s, a commercial form of jazz fusion called smooth jazz became successful, garnering significant radio airplay. Other styles and genres abound in the 21st century, such as Latin and Afro-Cuban jazz.",jazz music genre originated african american community new orleans louisiana late th early th century root blue ragtime european harmony african rhythmic ritual spiritual hymn march vaudeville song dance music since jazz age recognized major form musical expression traditional popular music jazz characterized swing blue note complex chord call response vocal polyrhythms improvisation jazz spread around world drew national regional local musical culture gave rise different style new orleans jazz began early combining earlier brass band march french quadrille biguine ragtime blue collective polyphonic improvisation however jazz begin single musical tradition new orleans elsewhere arranged dance oriented swing big band kansa city jazz hard swinging bluesy improvisational style gypsy jazz style emphasized musette waltz prominent style bebop emerged shifting jazz danceable popular music toward challenging musician music played faster tempo used chord based improvisation cool jazz developed near end introducing calmer smoother sound long linear melodic line mid saw emergence hard bop introduced influence rhythm blue gospel blue small group particularly saxophone piano modal jazz developed late using mode musical scale basis musical structure improvisation free jazz explored playing without regular meter beat formal structure jazz fusion appeared late early combining jazz improvisation rock music rhythm electric instrument highly amplified stage sound early commercial form jazz fusion called smooth jazz became successful garnering significant radio airplay style genre abound st century latin afro cuban jazz
music_3.txt,music,"Rock music is a genre of popular music that originated in the United States as ""rock and roll"" in the late 1940s and early 1950s, developing into a range of styles from the mid-1960s, primarily in the United States and United Kingdom. It has its roots in rock and roll, a style that drew from the black musical genres of blues and rhythm and blues, as well as from country music. Rock also drew strongly from genres such as electric blues and folk, and incorporated influences from jazz and other styles. Rock is typically centered on the electric guitar, usually as part of a rock group with electric bass guitar, drums, and one or more singers. Usually, rock is song-based music with a 44 time signature and using a verse–chorus form; however, the genre has become extremely diverse. Like pop music, lyrics often stress romantic love but also address a wide variety of other themes that are frequently social or political. Rock was the most popular genre of music in the U.S. and much of the western world from the 1950s up to the 2010s. Rock musicians in the mid-1960s began to advance the album ahead of the single as the dominant form of recorded music expression and consumption, with the Beatles at the forefront of this development. Their contributions lent the genre a cultural legitimacy in the mainstream and initiated a rock-informed album era in the music industry for the next several decades. By the late 1960s ""classic rock"" period, a few distinct rock music subgenres had emerged, including hybrids like blues rock, folk rock, country rock, southern rock, raga rock, and jazz rock, which contributed to the development of psychedelic rock, influenced by the countercultural psychedelic and hippie scene. New genres that emerged included progressive rock, which extended artistic elements, heavy metal, which emphasized an aggressive thick sound, and glam rock, which highlighted showmanship and visual style. In the second half of the 1970s, punk rock reacted by producing stripped-down, energetic social and political critiques. Punk was an influence in the 1980s on new wave, post-punk and eventually alternative rock.",rock music genre popular music originated united state rock roll late early developing range style mid primarily united state united kingdom root rock roll style drew black musical genre blue rhythm blue well country music rock also drew strongly genre electric blue folk incorporated influence jazz style rock typically centered electric guitar usually part rock group electric bass guitar drum one singer usually rock song based music time signature using verse chorus form however genre become extremely diverse like pop music lyric often stress romantic love also address wide variety theme frequently social political rock popular genre music much western world rock musician mid began advance album ahead single dominant form recorded music expression consumption beatles forefront development contribution lent genre cultural legitimacy mainstream initiated rock informed album era music industry next several decade late classic rock period distinct rock music subgenres emerged including hybrid like blue rock folk rock country rock southern rock raga rock jazz rock contributed development psychedelic rock influenced countercultural psychedelic hippie scene new genre emerged included progressive rock extended artistic element heavy metal emphasized aggressive thick sound glam rock highlighted showmanship visual style second half punk rock reacted producing stripped energetic social political critique punk influence new wave post punk eventually alternative rock
music_4.txt,music,"Hip-hop (also known as rap music or simply rap) is a popular music genre that emerged in the early 1970s alongside an associated subculture in the African-American and Latino communities of New York City. The musical style is characterized by the synthesis of a wide range of techniques, but rapping is frequent enough that it has become a defining characteristic. Other key markers of the genre are the disc jockey (DJ), turntablism, scratching, beatboxing, and instrumental tracks. Cultural interchange has always been central to the hip-hop genre; it simultaneously borrows from its social environment while commenting on it. The hip-hop genre and culture emerged from block parties in ethnic minority neighborhoods of New York City, particularly the Bronx. DJs began expanding the instrumental breaks of popular records when they noticed how excited it would make the crowds. The extended breaks provided a platform for break dancers and rappers. These breakbeats enabled the subsequent evolution of the hip-hop style. Many of the records used were disco due to its popularity at the time. This disco-inflected music was originally known as disco-rap and later described as ""old-school hip-hop"". In the late 1980s and 1990s, hip-hop began to diversify as electro music started to inform a style later known as ""new-school hip-hop"". The transition between the mid-1980s and 1990s became known as ""hip-hop's golden age"", as the genre earned widespread critical acclaim and generated massive sales. Across the United States, several regional scenes emerged, most notably on the East and West Coasts, as well as in the South, which included the Houston, Atlanta and Memphis rap scenes. This era saw the emergence of popular styles such as G-funk, boom bap and gangsta rap, as well as more experimental genres like alternative hip-hop and jazz rap, which stemmed from the Native Tongues movement, alongside progressive and conscious hip-hop.",hip hop also known rap music simply rap popular music genre emerged early alongside associated subculture african american latino community new york city musical style characterized synthesis wide range technique rapping frequent enough become defining characteristic key marker genre disc jockey dj turntablism scratching beatboxing instrumental track cultural interchange always central hip hop genre simultaneously borrows social environment commenting hip hop genre culture emerged block party ethnic minority neighborhood new york city particularly bronx dj began expanding instrumental break popular record noticed excited would make crowd extended break provided platform break dancer rapper breakbeats enabled subsequent evolution hip hop style many record used disco due popularity time disco inflected music originally known disco rap later described old school hip hop late hip hop began diversify electro music started inform style later known new school hip hop transition mid became known hip hop golden age genre earned widespread critical acclaim generated massive sale across united state several regional scene emerged notably east west coast well south included houston atlanta memphis rap scene era saw emergence popular style funk boom bap gangsta rap well experimental genre like alternative hip hop jazz rap stemmed native tongue movement alongside progressive conscious hip hop
music_5.txt,music,"Electronic music broadly is a group of music genres that employ electronic musical instruments, circuitry-based music technology and software, or general-purpose electronics (such as personal computers) in its creation. It includes both music made using electronic and electromechanical means (electroacoustic music). Pure electronic instruments depend entirely on circuitry-based sound generation, for instance using devices such as an electronic oscillator, theremin, or synthesizer: no acoustic waves need to be previously generated by mechanical means and then converted into electrical signals. On the other hand, electromechanical instruments have mechanical parts such as strings or hammers that generate the sound waves, together with electric elements including magnetic pickups, power amplifiers and loudspeakers that convert the acoustic waves into electrical signals, process them and convert them back into sound waves. Such electromechanical devices include the telharmonium, Hammond organ, electric piano and electric guitar. The first electronic musical devices were developed at the end of the 19th century. During the 1920s and 1930s, some electronic instruments were introduced and the first compositions featuring them were written. By the 1940s, magnetic audio tape allowed musicians to tape sounds and then modify them by changing the tape speed or direction, leading to the development of electroacoustic tape music in the 1940s in Egypt and France. Musique concrète, created in Paris in 1948, was based on editing together recorded fragments of natural and industrial sounds. Music produced solely from electronic generators was first produced in Germany in 1953 by Karlheinz Stockhausen. Electronic music was also created in Japan and the United States beginning in the 1950s and algorithmic composition with computers was first demonstrated in the same decade. During the 1960s, digital computer music was pioneered, innovation in live electronics took place, and Japanese electronic musical instruments began to influence the music industry. In the early 1970s, Moog synthesizers and drum machines helped popularize synthesized electronic music. The 1970s also saw electronic music begin to have a significant influence on popular music, with the adoption of polyphonic synthesizers, electronic drums, drum machines, and turntables, through the emergence of genres such as disco, krautrock, new wave, synth-pop, hip hop and electronic dance music (EDM). In the early 1980s, mass-produced digital synthesizers such as the Yamaha DX7 became popular which saw development of the MIDI (Musical Instrument Digital Interface). In the same decade, with a greater reliance on synthesizers and the adoption of programmable drum machines, electronic popular music came to the fore. During the 1990s, with the proliferation of increasingly affordable music technology, electronic music production became an established part of popular culture. In Berlin starting in 1989, the Love Parade became the largest street party with over 1 million visitors, inspiring other such popular celebrations of electronic music.",electronic music broadly group music genre employ electronic musical instrument circuitry based music technology software general purpose electronics personal computer creation includes music made using electronic electromechanical mean electroacoustic music pure electronic instrument depend entirely circuitry based sound generation instance using device electronic oscillator theremin synthesizer acoustic wave need previously generated mechanical mean converted electrical signal hand electromechanical instrument mechanical part string hammer generate sound wave together electric element including magnetic pickup power amplifier loudspeaker convert acoustic wave electrical signal process convert back sound wave electromechanical device include telharmonium hammond organ electric piano electric guitar first electronic musical device developed end th century electronic instrument introduced first composition featuring written magnetic audio tape allowed musician tape sound modify changing tape speed direction leading development electroacoustic tape music egypt france musique concr te created paris based editing together recorded fragment natural industrial sound music produced solely electronic generator first produced germany karlheinz stockhausen electronic music also created japan united state beginning algorithmic composition computer first demonstrated decade digital computer music pioneered innovation live electronics took place japanese electronic musical instrument began influence music industry early moog synthesizer drum machine helped popularize synthesized electronic music also saw electronic music begin significant influence popular music adoption polyphonic synthesizer electronic drum drum machine turntable emergence genre disco krautrock new wave synth pop hip hop electronic dance music edm early mass produced digital synthesizer yamaha dx became popular saw development midi musical instrument digital interface decade greater reliance synthesizer adoption programmable drum machine electronic popular music came fore proliferation increasingly affordable music technology electronic music production became established part popular culture berlin starting love parade became largest street party million visitor inspiring popular celebration electronic music
technology_1.txt,technology,"Artificial intelligence (AI) is the capability of computational systems to perform tasks typically associated with human intelligence, such as learning, reasoning, problem-solving, perception, and decision-making. It is a field of research in computer science that develops and studies methods and software that enable machines to perceive their environment and use learning and intelligence to take actions that maximize their chances of achieving defined goals. High-profile applications of AI include advanced web search engines (e.g., Google Search); recommendation systems (used by YouTube, Amazon, and Netflix); virtual assistants (e.g., Google Assistant, Siri, and Alexa); autonomous vehicles (e.g., Waymo); generative and creative tools (e.g., language models and AI art); and superhuman play and analysis in strategy games (e.g., chess and Go). However, many AI applications are not perceived as AI: ""A lot of cutting edge AI has filtered into general applications, often without being called AI because once something becomes useful enough and common enough it's not labeled AI anymore."" Various subfields of AI research are centered around particular goals and the use of particular tools. The traditional goals of AI research include learning, reasoning, knowledge representation, planning, natural language processing, perception, and support for robotics. To reach these goals, AI researchers have adapted and integrated a wide range of techniques, including search and mathematical optimization, formal logic, artificial neural networks, and methods based on statistics, operations research, and economics. AI also draws upon psychology, linguistics, philosophy, neuroscience, and other fields. Some companies, such as OpenAI, Google DeepMind and Meta, aim to create artificial general intelligence (AGI)—AI that can complete virtually any cognitive task at least as well as a human.",artificial intelligence ai capability computational system perform task typically associated human intelligence learning reasoning problem solving perception decision making field research computer science develops study method software enable machine perceive environment use learning intelligence take action maximize chance achieving defined goal high profile application ai include advanced web search engine google search recommendation system used youtube amazon netflix virtual assistant google assistant siri alexa autonomous vehicle waymo generative creative tool language model ai art superhuman play analysis strategy game chess go however many ai application perceived ai lot cutting edge ai filtered general application often without called ai something becomes useful enough common enough labeled ai anymore various subfields ai research centered around particular goal use particular tool traditional goal ai research include learning reasoning knowledge representation planning natural language processing perception support robotics reach goal ai researcher adapted integrated wide range technique including search mathematical optimization formal logic artificial neural network method based statistic operation research economics ai also draw upon psychology linguistics philosophy neuroscience field company openai google deepmind meta aim create artificial general intelligence agi ai complete virtually cognitive task least well human
technology_2.txt,technology,"Machine learning (ML) is a field of study in artificial intelligence concerned with the development and study of statistical algorithms that can learn from data and generalise to unseen data, and thus perform tasks without explicit instructions. Within a subdiscipline in machine learning, advances in the field of deep learning have allowed neural networks, a class of statistical algorithms, to surpass many previous machine learning approaches in performance. ML finds application in many fields, including natural language processing, computer vision, speech recognition, email filtering, agriculture, and medicine. The application of ML to business problems is known as predictive analytics. Statistics and mathematical optimisation (mathematical programming) methods comprise the foundations of machine learning. Data mining is a related field of study, focusing on exploratory data analysis (EDA) via unsupervised learning.",machine learning ml field study artificial intelligence concerned development study statistical algorithm learn data generalise unseen data thus perform task without explicit instruction within subdiscipline machine learning advance field deep learning allowed neural network class statistical algorithm surpass many previous machine learning approach performance ml find application many field including natural language processing computer vision speech recognition email filtering agriculture medicine application ml business problem known predictive analytics statistic mathematical optimisation mathematical programming method comprise foundation machine learning data mining related field study focusing exploratory data analysis eda via unsupervised learning
technology_3.txt,technology,"In computer science, computer engineering, and telecommunications, a network is a group of communicating computers and peripherals known as hosts, which communicate data to other hosts via communication protocols, as facilitated by networking hardware. Within a computer network, hosts are identified by network addresses, which allow network software such as the Internet Protocol to locate and identify hosts. Hosts may also have hostnames, memorable labels for the host nodes, which can be mapped to a network address using a hosts file or a name server such as Domain Name Service. The physical medium that supports information exchange includes wired media like copper cables, optical fibers, and wireless radio-frequency media. The arrangement of hosts and hardware within a network architecture is known as the network topology. The first computer network was created in 1940 when George Stibitz connected a terminal at Dartmouth to his Complex Number Calculator at Bell Labs in New York. Today, almost all computers are connected to a computer network, such as the global Internet or embedded networks such as those found in many modern electronic devices. Many applications have only limited functionality unless they are connected to a network. Networks support applications and services, such as access to the World Wide Web, digital video and audio, application and storage servers, printers, and email and instant messaging applications.",computer science computer engineering telecommunication network group communicating computer peripheral known host communicate data host via communication protocol facilitated networking hardware within computer network host identified network address allow network software internet protocol locate identify host host may also hostnames memorable label host node mapped network address using host file name server domain name service physical medium support information exchange includes wired medium like copper cable optical fiber wireless radio frequency medium arrangement host hardware within network architecture known network topology first computer network created george stibitz connected terminal dartmouth complex number calculator bell lab new york today almost computer connected computer network global internet embedded network found many modern electronic device many application limited functionality unless connected network network support application service access world wide web digital video audio application storage server printer email instant messaging application
